{"$schema":"https://json-schema.org/draft/2020-12/schema","$id":"packet.schema.json","type":"object","additionalProperties":false,"required":["record_type","schema_version","packet_id","created_at","created_by","deposited_by","content_origin","source_refs","derivative_of","provenance_coverage","source_session","target_session","topic","status","path","response_expected","response_packet_id","tags","notes"],"properties":{"record_type":{"const":"packet"},"schema_version":{"$ref":"common.schema.json#/$defs/schema_version"},"packet_id":{"$ref":"common.schema.json#/$defs/artifact_id"},"created_at":{"$ref":"common.schema.json#/$defs/timestamp"},"created_by":{"type":"string","minLength":1},"deposited_by":{"type":"string","minLength":1},"content_origin":{"$ref":"common.schema.json#/$defs/origin"},"source_refs":{"type":"array","items":{"type":"string","minLength":1}},"derivative_of":{"type":"array","items":{"type":"string","minLength":1}},"provenance_coverage":{"$ref":"common.schema.json#/$defs/coverage"},"source_session":{"type":"string","minLength":1},"target_session":{"type":"string","minLength":1},"topic":{"$ref":"common.schema.json#/$defs/slug"},"status":{"enum":["new","in_review","answered","superseded","archived"]},"path":{"$ref":"common.schema.json#/$defs/safe_path"},"response_expected":{"type":"boolean"},"response_packet_id":{"type":["string","null"]},"tags":{"type":"array","items":{"$ref":"common.schema.json#/$defs/slug"},"uniqueItems":true},"notes":{"type":"string"}},"allOf":[{"if":{"properties":{"content_origin":{"enum":["third_party","web","mixed"]}}},"then":{"properties":{"source_refs":{"minItems":1}}}},{"if":{"properties":{"content_origin":{"const":"model_generated"}}},"then":{"properties":{"derivative_of":{"minItems":1}}}}]}