{
  "record_type": "packet",
  "schema_version": 1,
  "packet_id": "20260902-example-session-fixture",
  "created_at": "2026-09-02T12:00:00Z",
  "created_by": "example-session",
  "deposited_by": "example-session",
  "content_origin": "operator_authored",
  "source_refs": [],
  "derivative_of": [],
  "provenance_coverage": "record_level",
  "source_session": "example-session",
  "target_session": "review-session",
  "topic": "fixture",
  "status": "new",
  "path": "tests/fixtures/valid/packet/artifact.md",
  "response_expected": false,
  "response_packet_id": null,
  "tags": [
    "fixture-tag"
  ],
  "notes": "Public-safe validator fixture."
}
