{
  "record_type": "packet",
  "schema_version": 1,
  "packet_id": "20260602-assistant-session-a-example-topic",
  "created_at": "2026-06-02T10:00:00Z",
  "created_by": "example-operator",
  "deposited_by": "example-operator",
  "content_origin": "operator_authored",
  "source_refs": [],
  "derivative_of": [],
  "provenance_coverage": "record_level",
  "source_session": "assistant-session-a",
  "target_session": "assistant-session-b",
  "topic": "example-topic",
  "status": "new",
  "path": "examples/example_datadrop_packet.md",
  "response_expected": true,
  "response_packet_id": "20260602-assistant-session-b-example-critique",
  "tags": [],
  "notes": "Paired with the fictional datadrop example."
}
